{
  "components": [
    {
      "disclosure": "Source attribution, not a legal warranty or reconstructed historical build.",
      "evidence": [
        {
          "path": "Apache-2.0.txt",
          "role": "license",
          "scope": "Full Apache License 2.0",
          "sha256": "cfc7749b96f63bd31c3c42b5c471bf756814053e847c10f3eb003417bc523d30",
          "size": 11358,
          "source": "https://www.apache.org/licenses/LICENSE-2.0.txt"
        },
        {
          "path": "attribution/androidx.concurrent--concurrent-futures--1.1.0.txt",
          "role": "attribution",
          "scope": "Full copyright/license headers and legal members in this exact published source archive; source-set scope can exceed the Android payload, not proof that every source file ships.",
          "sha256": "882baf86144215cefb53db68e59e7f9bb8c1301158163e5bca8eea4522c3c920",
          "size": 1092,
          "source": "https://dl.google.com/dl/android/maven2/androidx/concurrent/concurrent-futures/1.1.0/concurrent-futures-1.1.0-sources.jar"
        }
      ],
      "id": "androidx.concurrent:concurrent-futures:1.1.0",
      "license": "Apache-2.0",
      "name": "androidx.concurrent:concurrent-futures",
      "noticeScope": "Published versioned source archive legal members and source headers preserved. No claim about absence of every historical notice.",
      "sourceArchive": {
        "sha256": "cc06fb6045a6c066f50e237a3c2126bc88c16d358a57b3612ba633c9f530b0a0",
        "url": "https://dl.google.com/dl/android/maven2/androidx/concurrent/concurrent-futures/1.1.0/concurrent-futures-1.1.0-sources.jar"
      },
      "version": "1.1.0"
    },
    {
      "disclosure": "Source attribution, not a legal warranty or reconstructed historical build.",
      "evidence": [
        {
          "path": "Apache-2.0.txt",
          "role": "license",
          "scope": "Full Apache License 2.0",
          "sha256": "cfc7749b96f63bd31c3c42b5c471bf756814053e847c10f3eb003417bc523d30",
          "size": 11358,
          "source": "https://www.apache.org/licenses/LICENSE-2.0.txt"
        },
        {
          "path": "attribution/com.google.guava--listenablefuture--1.0.txt",
          "role": "attribution",
          "scope": "Full copyright/license headers and legal members in this exact published source archive; source-set scope can exceed the Android payload, not proof that every source file ships.",
          "sha256": "72c67c0b9ceb923bc5be9c4a626baee776ffcf06ce1b40448abcf35605ebe912",
          "size": 894,
          "source": "https://repo.maven.apache.org/maven2/com/google/guava/listenablefuture/1.0/listenablefuture-1.0-sources.jar"
        }
      ],
      "id": "com.google.guava:listenablefuture:1.0",
      "license": "Apache-2.0",
      "name": "com.google.guava:listenablefuture",
      "noticeScope": "Published versioned source archive legal members and source headers preserved. No claim about absence of every historical notice.",
      "sourceArchive": {
        "sha256": "3d1bd8d4a39b293612a40e547ec51d9ce34fa638d7adeae83871cdbe2923b161",
        "url": "https://repo.maven.apache.org/maven2/com/google/guava/listenablefuture/1.0/listenablefuture-1.0-sources.jar"
      },
      "version": "1.0"
    },
    {
      "disclosure": "Source attribution, not a legal warranty or reconstructed historical build.",
      "evidence": [
        {
          "path": "Apache-2.0.txt",
          "role": "license",
          "scope": "Full Apache License 2.0",
          "sha256": "cfc7749b96f63bd31c3c42b5c471bf756814053e847c10f3eb003417bc523d30",
          "size": 11358,
          "source": "https://www.apache.org/licenses/LICENSE-2.0.txt"
        },
        {
          "path": "attribution/androidx.activity--activity-compose--1.13.0.txt",
          "role": "attribution",
          "scope": "Full copyright/license headers and legal members in this exact published source archive; source-set scope can exceed the Android payload, not proof that every source file ships.",
          "sha256": "d66697a34a1aaf996b5e0cb6278ce678a3908c74f49a82a31c3b98996a30d235",
          "size": 3868,
          "source": "https://dl.google.com/dl/android/maven2/androidx/activity/activity-compose/1.13.0/activity-compose-1.13.0-sources.jar"
        }
      ],
      "id": "androidx.activity:activity-compose:1.13.0",
      "license": "Apache-2.0",
      "name": "androidx.activity:activity-compose",
      "noticeScope": "Published versioned source archive legal members and source headers preserved. No claim about absence of every historical notice.",
      "sourceArchive": {
        "sha256": "968cda8fb2bf4c80f952b442d05657773e6e373507700e621d1092d43b6751c5",
        "url": "https://dl.google.com/dl/android/maven2/androidx/activity/activity-compose/1.13.0/activity-compose-1.13.0-sources.jar"
      },
      "version": "1.13.0"
    },
    {
      "disclosure": "Source attribution, not a legal warranty or reconstructed historical build.",
      "evidence": [
        {
          "path": "Apache-2.0.txt",
          "role": "license",
          "scope": "Full Apache License 2.0",
          "sha256": "cfc7749b96f63bd31c3c42b5c471bf756814053e847c10f3eb003417bc523d30",
          "size": 11358,
          "source": "https://www.apache.org/licenses/LICENSE-2.0.txt"
        },
        {
          "path": "attribution/androidx.activity--activity-ktx--1.13.0.txt",
          "role": "attribution",
          "scope": "Full copyright/license headers and legal members in this exact published source archive; source-set scope can exceed the Android payload, not proof that every source file ships.",
          "sha256": "9ab130bf7ff070a2eb1a34c6ea52a9b580ef427b9d8c22d6ac18effb45c45eca",
          "size": 225,
          "source": "https://dl.google.com/dl/android/maven2/androidx/activity/activity-ktx/1.13.0/activity-ktx-1.13.0-sources.jar"
        }
      ],
      "id": "androidx.activity:activity-ktx:1.13.0",
      "license": "Apache-2.0",
      "name": "androidx.activity:activity-ktx",
      "noticeScope": "Published versioned source archive legal members and source headers preserved. No claim about absence of every historical notice.",
      "sourceArchive": {
        "sha256": "e3201cf6c56fade2fc70e2f70408260992b83ddf0ccf4b69221a98ae26c02d74",
        "url": "https://dl.google.com/dl/android/maven2/androidx/activity/activity-ktx/1.13.0/activity-ktx-1.13.0-sources.jar"
      },
      "version": "1.13.0"
    },
    {
      "disclosure": "Source attribution, not a legal warranty or reconstructed historical build.",
      "evidence": [
        {
          "path": "Apache-2.0.txt",
          "role": "license",
          "scope": "Full Apache License 2.0",
          "sha256": "cfc7749b96f63bd31c3c42b5c471bf756814053e847c10f3eb003417bc523d30",
          "size": 11358,
          "source": "https://www.apache.org/licenses/LICENSE-2.0.txt"
        },
        {
          "path": "attribution/androidx.activity--activity--1.13.0.txt",
          "role": "attribution",
          "scope": "Full copyright/license headers and legal members in this exact published source archive; source-set scope can exceed the Android payload, not proof that every source file ships.",
          "sha256": "046bede60b293c59278ef078458177a908fe27240b0cbbd324aa015d426467c7",
          "size": 6709,
          "source": "https://dl.google.com/dl/android/maven2/androidx/activity/activity/1.13.0/activity-1.13.0-sources.jar"
        }
      ],
      "id": "androidx.activity:activity:1.13.0",
      "license": "Apache-2.0",
      "name": "androidx.activity:activity",
      "noticeScope": "Published versioned source archive legal members and source headers preserved. No claim about absence of every historical notice.",
      "sourceArchive": {
        "sha256": "c7cf1b2e315e08867b10ef4505945d1993d90281445c65b929e81b9420216ce9",
        "url": "https://dl.google.com/dl/android/maven2/androidx/activity/activity/1.13.0/activity-1.13.0-sources.jar"
      },
      "version": "1.13.0"
    },
    {
      "disclosure": "Source attribution, not a legal warranty or reconstructed historical build.",
      "evidence": [
        {
          "path": "Apache-2.0.txt",
          "role": "license",
          "scope": "Full Apache License 2.0",
          "sha256": "cfc7749b96f63bd31c3c42b5c471bf756814053e847c10f3eb003417bc523d30",
          "size": 11358,
          "source": "https://www.apache.org/licenses/LICENSE-2.0.txt"
        },
        {
          "path": "attribution/androidx.annotation--annotation-experimental--1.4.1.txt",
          "role": "attribution",
          "scope": "Full copyright/license headers and legal members in this exact published source archive; source-set scope can exceed the Android payload, not proof that every source file ships.",
          "sha256": "a88de7fe628467b9f51c505688e9046fccd5e7e736489b758b9235f0a135994a",
          "size": 1690,
          "source": "https://dl.google.com/dl/android/maven2/androidx/annotation/annotation-experimental/1.4.1/annotation-experimental-1.4.1-sources.jar"
        }
      ],
      "id": "androidx.annotation:annotation-experimental:1.4.1",
      "license": "Apache-2.0",
      "name": "androidx.annotation:annotation-experimental",
      "noticeScope": "Published versioned source archive legal members and source headers preserved. No claim about absence of every historical notice.",
      "sourceArchive": {
        "sha256": "783a221a7c1093ff8932053998a69a24489f7930806a32b55366108146d29c1d",
        "url": "https://dl.google.com/dl/android/maven2/androidx/annotation/annotation-experimental/1.4.1/annotation-experimental-1.4.1-sources.jar"
      },
      "version": "1.4.1"
    },
    {
      "disclosure": "Source attribution, not a legal warranty or reconstructed historical build.",
      "evidence": [
        {
          "path": "Apache-2.0.txt",
          "role": "license",
          "scope": "Full Apache License 2.0",